phone,address,description,name,link
985986736,"số 9, ngõ 16, Phan ĐÌnh Giót, La Khê, Hà Đông, Hà Đông, Vietnam",N/A,Mỹ Phẩm Nhật Bản Dr.Placen,https://www.facebook.com/RoyalT.bayre?__tn__=%3C
038 314 5658,"Hà Nội, Hà Đông, Vietnam",N/A,Mỹ Phẩm Xách Tay Chính Hãng Am Cosmetics,https://www.facebook.com/profile.php?id=100094633977477&__tn__=%3C
862378568,"khu cán bộ bv 103 , Hà Đông, Vietnam",N/A,Mỹ phẩm cao cấp Hàn Quốc,https://www.facebook.com/profile.php?id=100066619824255&__tn__=%3C
N/A,"Phố Lê Lợi, Hà Nội, Việt Nam, Hà Đông, Vietnam",N/A,Mỹ phẩm xách tay hàn quốc- chính hãng,https://www.facebook.com/profile.php?id=100083341391162&__tn__=%3C
N/A,"Phố Phú Lương, Hà Nội, Việt Nam, Hà Đông, Vietnam",N/A,Mỹ phẩm thiên nhiên Huyền Phi,https://www.facebook.com/profile.php?id=100078167060544&__tn__=%3C
0123 451 1331,N/A,N/A,Mỹ phẩm cao cấp-Lady Store,https://www.facebook.com/profile.php?id=100079203172104&__tn__=%3C
098 507 51 91,"Hà nội , Hà Đông, Vietnam",N/A,Mỹ Phẩm Linh Hương 91,https://www.facebook.com/profile.php?id=100093403586245&__tn__=%3C
N/A,N/A,N/A,Mỹ phẩm chính hãng Đức,https://www.facebook.com/profile.php?id=100071955360868&__tn__=%3C
097 217 77 88,"Đường Phúc La-Văn Phú, Hà Nội, Việt Nam, Hà Đông, Vietnam",N/A,Mỹ Phẩm Tóc Tiện Dụng,https://www.facebook.com/profile.php?id=100072228819218&__tn__=%3C
N/A,"Phố Hà Cầu, Hà Nội, Việt Nam, Hà Đông, Vietnam",N/A,Mỹ Phẩm - Nước Hoa Authentic,https://www.facebook.com/profile.php?id=100070120509425&__tn__=%3C
091 988 11 55,N/A,N/A,Mỹ phẩm thiên nhiên cao cấp,https://www.facebook.com/profile.php?id=100064273050318&__tn__=%3C
098 598 23 91,"40 cổ nhuế , Hanoi, Vietnam",N/A,TIỆM MỸ PHẨM LUY,https://www.facebook.com/tiemmyphamLUY?__tn__=%3C
N/A,"Cầu Đuống Nôi, Hà Nội, Việt Nam, Hà Đông, Vietnam",N/A,Mỹ phẩm thiên nhiên thu trang,https://www.facebook.com/profile.php?id=100069073762510&__tn__=%3C
083 366 1825,"Phường kiến hưng, Hà Đông, Vietnam",N/A,Mỹ phẩm xách tay hàn quốc,https://www.facebook.com/profile.php?id=100076183129903&__tn__=%3C
879015196,"Cầu Am, Hà Đông, Hà Nội, Hà Đông, Vietnam",N/A,Mỹ Phẩm Sammy Korea Beauty - Hàn Quốc Chính Hãng,https://www.facebook.com/MyPhamSammyKoreaBeautyHanQuocChinhHangg?__tn__=%3C
N/A,"Hà nôi, Hà Đông, Vietnam",N/A,Mỹ phẩm chính hãng giá gốc,https://www.facebook.com/profile.php?id=100086727812138&__tn__=%3C
N/A,N/A,N/A,Mỹ Phẩm thiên nhiên LACO,https://www.facebook.com/profile.php?id=100064798063057&__tn__=%3C
0985 858 848,N/A,N/A,Mỹ phẩm chính hãng Hàn Quốc,https://www.facebook.com/InnisfreeHanoiVN?__tn__=%3C
N/A,N/A,N/A,Mỹ Phẩm Nhập Khẩu Chính Hãng,https://www.facebook.com/thoitrangxinhshop68?__tn__=%3C
0362 536 102,"68 Khúc Thừa Dụ- Cầu Giấy, Hanoi, Vietnam",N/A,Mỹ Phẩm Huyền Phi Chính Hãng,https://www.facebook.com/profile.php?id=100086361851007&__tn__=%3C
091 943 11 93,"Hà Nội, Hà Đông, Vietnam",N/A,Mỹ Phẩm Cao Cấp Chính Hãng Hàn Quốc,https://www.facebook.com/profile.php?id=100085139761045&__tn__=%3C
"247
247
225",N/A,N/A,Mỹ Phẩm Hàn Quốc - Hoàn Nguyễn,https://www.facebook.com/profile.php?id=100089508052979&__tn__=%3C
098 444 38 45,N/A,N/A,Mỹ phẩm Diamond Luxury Trịnh Phương,https://www.facebook.com/profile.php?id=100076577856319&__tn__=%3C
N/A,"Dương nội, Hà Đông, Vietnam",N/A,Mỹ phẩm thiên nhiên Laco- đẹp từ tâm,https://www.facebook.com/profile.php?id=100089577578019&__tn__=%3C
098 410 59 91,"Hồ Chí Minh, Ho Chi Minh City, Vietnam",N/A,Trần Ngọc Phương Mai Mỹ phẩm mairis chính hãng,https://www.facebook.com/profile.php?id=61564200129779&__cft__[0]=AZay52C7kAkta_OiwAIBNJosRtn1L_T77HjdMXpwWRnzemYoC1dz5mHLz_xUjqU02zH3YlNc7TXznaKEG47oKt04q5IZx7wr-iwUMQ0mWeOJgd2j4TOPyOHpEn7BNO_GqESXyq2ioJVx2RLl6ds6mpiE24TaJEdvRaYetA5F9UUs8OIOWCDMfCOEq33m0diSv2sIDV6QZaMLj2FqgIzXL-CZeYtjh_d8U32UW_Sx2NjaW5YnW5Ey1_wnHDNmBWbWyO0YPFKHFwR-kODl4O8vWRPh0_sXL1DktabpNV8sRmkQFKzS8aQbwLBFhzVxGPvx-7qaZyeFO6SgGB0UkOVH46om&__tn__=%3C%2CP-R
037 264 0407,"Ngõ 58 Cầu Am, Hà Đông, Hanoi, Vietnam",N/A,Mỹ Phẩm Châu Âu - Ba Lan Xách Tay,https://www.facebook.com/myphamchauaubalanxachtay?__tn__=%3C
N/A,"Hà Đông, Hà Đông, Vietnam",N/A,Mỹ Phẩm Cao Cấp - Hi Beauty,https://www.facebook.com/profile.php?id=100069480963307&__tn__=%3C
038 629 2799,"Số 9, ngách 73/6, ngõ 1194 Đường Láng, P Láng Thượng, Q Đống Đa, TP Hà Nội, Hanoi, Vietnam",N/A,AOM - Mỹ phẩm Thảo dược Núi rừng,https://www.facebook.com/aom.myphamthaoduoc?__tn__=%3C
096 366 40 88,"59 Trần Đăng Ninh, Hanoi, Vietnam",N/A,Mỹ Phẩm Cẩm Tú,https://www.facebook.com/mpcamtu?__tn__=%3C
972796578,"tổ Dân phố đội cấn vĩnh tường phú thọ, Vinh Tuong, Vietnam",N/A,Viên Dung - Mỹ Phẩm Chính Hãng,https://www.facebook.com/VienDungBeauty?__tn__=%3C
096 277 84 48,"Lê Trọng Tấn, Hà Đông, Hà Nội, Hà Đông, Vietnam",N/A,"Mỹ Phẩm HaCos - Trẻ Hóa Da, Xóa Nám Tàn Nhang - 0962.77.8448",https://www.facebook.com/profile.php?id=100067167382209&__tn__=%3C
038 257 0997,"Số 10 trần phú Hà Đông, Hanoi, Hà Đông, Vietnam",N/A,Mỹ Phẩm Trẻ Hóa Da 8 Trong 1 - Hoshi ローション,https://www.facebook.com/profile.php?id=100069162882720&__tn__=%3C
N/A,"Phố Nguyễn Văn Lộc, Hà Nội, Việt Nam, Hà Đông, Vietnam",N/A,Mỹ Phẩm Giá Sỉ Beauty Chính Hãng,https://www.facebook.com/profile.php?id=100083737412951&__tn__=%3C
0333 58 1818,"BT06 ngõ 6 Nguyễn Văn Lộc, Mộ Lao, Hà Đông, Hanoi, Vietnam , Hà Đông, Vietnam",N/A,Mỹ phẩm Anh Quốc by Huế,https://www.facebook.com/profile.php?id=100084838480825&__tn__=%3C
097 934 89 93,"Số 14, đường 70 ( Gần khu đô thị xa la ), tân triều, hà nội, Hanoi, Vietnam",N/A,Shop Mỹ Phẩm Bo Bo - Myphambo.com,https://www.facebook.com/myphambobo?__tn__=%3C
N/A,N/A,N/A,Mỹ phẩm Auth chính hãng,https://www.facebook.com/profile.php?id=100083362551662&__tn__=%3C
089 859 46 78,"Phố Xa La, Hà Nội, Việt Nam, Hà Đông, Vietnam",N/A,Mỹ phẩm Hàn Quốc Hebecell,https://www.facebook.com/profile.php?id=100075939982699&__tn__=%3C
094 276 19 86,N/A,N/A,Mỹ Phẩm Thiên Nhiên Huyền Phi,https://www.facebook.com/huyentrang010495?__tn__=%3C
033 333 0364,"hanoi, Phùng Khoang, Vietnam",N/A,Mỹ Phẩm SANDY Chính Hãng,https://www.facebook.com/profile.php?id=100086402864872&__tn__=%3C
032 824 2544,"Hà Đông , Hà Đông, Vietnam",N/A,Mỹ phẩm thiên nhiên trầu không,https://www.facebook.com/profile.php?id=100087245635251&__tn__=%3C
035 430 6223,"Tòa Victoria KĐT Văn Phú, Hà Đông, Hanoi, Vietnam",N/A,Mỹ Phẩm MoCha - Tổng Đại Lý Phân Phối Miền Bắc,https://www.facebook.com/thaomoclunon?__tn__=%3C
962849908,"L01-L02 An Phú shop Villa, Dương Nội, Hanoi, Vietnam",N/A,AURA STORE - Phân Phối Mỹ Phẩm Cao Cấp TOP 1,https://www.facebook.com/aura.cosmeticstore?__tn__=%3C
866063096,"79 đường 19/5 Văn Quán, Hà Đông, Vietnam",N/A,Mỹ phẩm trị thâm nám trẻ hóa da,https://www.facebook.com/profile.php?id=100070708545850&__tn__=%3C
N/A,"Đường Đại Mỗ, Hà Nội, Việt Nam, Hà Đông, Vietnam",N/A,Mỹ phẩm Nội Địa Trung Official Store,https://www.facebook.com/profile.php?id=100076451914241&__tn__=%3C
098 738 88 20,"Hà Nội, Hà Đông, Vietnam",N/A,Mỹ phẩm thiên nhiên Mộc Nhan,https://www.facebook.com/profile.php?id=100086018331980&__tn__=%3C
094 196 91 94,N/A,N/A,Mỹ Phẩm Chính Hãng Xách Tay Nhật Bản,https://www.facebook.com/profile.php?id=100066713756508&__tn__=%3C
N/A,"Hà đông, Hà Đông, Vietnam",N/A,Mỹ Phẩm Chính Hãng Medi -Peel,https://www.facebook.com/profile.php?id=100083241526998&__tn__=%3C
096 473 86 69,"Mễ trì hạ - Nam từ liêm , Hanoi, Vietnam",N/A,GoGreen Mỹ phẩm phục hồi da,https://www.facebook.com/chamdadungkhoahoc?__tn__=%3C
N/A,"Đường Vạn Phúc, Hà Nội, Việt Nam, Hà Đông, Vietnam",N/A,Mỹ phẩm Chara quốc tế,https://www.facebook.com/profile.php?id=100080847935789&__tn__=%3C
083 348 4388,"Nhà số 10-12, ngõ 7 đường Vạn Xuân, Khu tái định cư Thôn Lai Xá, xã Kim Chung, huyện Hoài Đức, Thành phố Hà Nội, Hanoi, Vietnam",N/A,Mỹ Phẩm Bạch Liên,https://www.facebook.com/MyPhamBachLien?__tn__=%3C
N/A,N/A,N/A,Mỹ phẩm hàn quốc chính hãng,https://www.facebook.com/profile.php?id=100064831691808&__tn__=%3C
N/A,"ROYAL CITY, 72A Nguyễn Trãi, Phường Thượng Đình, Quận Thanh Xuân, Hanoi, Vietnam",N/A,Mỹ Phẩm Ngành Tóc Cosmetics,https://www.facebook.com/profile.php?id=61576855583842&__tn__=%3C
033 228 1297,"Hà Nội, Phường Mai Dịch, Vietnam",N/A,Mỹ Phẩm Chính Hãng CosmeticS,https://www.facebook.com/profile.php?id=100069620559666&__tn__=%3C
867496535,"143 Nguyễn Tuân, Thanh Xuân, Hanoi, Vietnam",N/A,Mỹ phẩm Hàn Quốc - Vanesa Korean,https://www.facebook.com/VanesaaHanQuoc?__tn__=%3C
094 436 26 38,N/A,N/A,Mỹ Phẩm Xách Tay Hàn - Nhật,https://www.facebook.com/myphamxachtayhannhat68?__tn__=%3C
034 705 0055,"Số 10, ngõ 58 đường Thanh Bình, Hanoi, Vietnam",N/A,Dược Mỹ Phẩm Chính Hãng Dr Nguyễn Quỳnh,https://www.facebook.com/profile.php?id=100091986695709&__tn__=%3C
097 362 57 12,"18 Hoàng Quốc Việt - Cầu Giấy, Hanoi, Vietnam",N/A,Dược Mỹ Phẩm Lamec,https://www.facebook.com/Congtycophanduocmyphamlamec?__tn__=%3C
096 916 89 95,"Số 36A, ngách 34/156 Vĩnh Tuy, Phường Vĩnh Tuy, Quận Hai Bà Trưng, Thành phố Hà Nội, Việt Nam, Hanoi, Vietnam",N/A,Dược Mỹ Phẩm Neutidi,https://www.facebook.com/neutidi?__tn__=%3C
N/A,"Cầu Đuống Nôi, Hà Nội, Việt Nam, Hà Đông, Vietnam",N/A,Siêu Thị Mỹ Phẩm Ngân Bình,https://www.facebook.com/profile.php?id=100080194705200&__tn__=%3C
866965179,"Số 89 Trần Vỹ - Mai Dịch- Cầu Giấy-Hà Nội, Hanoi, Vietnam",N/A,Mỹ Phẩm Hàn Quốc Chính Hãng,https://www.facebook.com/profile.php?id=100086089927912&__tn__=%3C
091 600 12 44,"Số 4 Ngõ 389 Hoàng Quốc Việt, Cầu Giấy, Hà Nội, Hanoi, Vietnam",N/A,Mỹ Phẩm Spa Chính Hãng Midora,https://www.facebook.com/MyPhamSpa.ChinhHang.Midora?__tn__=%3C
033 415 5868,"Khu Đô Thị Sunny, Xã Sài Sơn, Huyện Quốc Oai, Hanoi, Vietnam, Hanoi, Vietnam",N/A,Mỹ Phẩm Organic Thanh Mộc Hương,https://www.facebook.com/myphamorganicthanhmochuong?__tn__=%3C
N/A,"cầu giấy, Hanoi, Vietnam",N/A,Mỹ Phẩm Hàn Quốc Chính Hãng,https://www.facebook.com/profile.php?id=61574456312388&__tn__=%3C
038 200 9358,"Cầu Giấy, Hà Nội, Việt Nam, Hanoi, Vietnam",N/A,Mỹ phẩm - Giá tận gốc,https://www.facebook.com/profile.php?id=100069422425238&__tn__=%3C
098 504 21 45,"- Dạ địa chỉ shop em đây ạ 6 Đ. Nguyễn Khánh Toàn, Quan Hoa, Cầu Giấy, Hà Nội, Hanoi, Vietnam",N/A,Mỹ Phẩm Cao Cấp JaPan- V-N,https://www.facebook.com/profile.php?id=61579169985494&__tn__=%3C
091 568 74 89,"86, Trần Vỹ, Cầu Giấy, Hanoi, Vietnam",N/A,Mỹ Phẩm Huyền Phi Chính Hãng,https://www.facebook.com/profile.php?id=100083154079445&__tn__=%3C
096 959 33 34,"geleximco Dương Nội, Hanoi, Vietnam",N/A,Mỹ Phẩm Tóc Chính Hãng,https://www.facebook.com/myphamtocso1?__tn__=%3C
096 565 89 20,"30 Trần Hữu Dực, Hanoi, Vietnam",N/A,Mỹ Phẩm Nhập Khẩu Nga,https://www.facebook.com/MyphanDevelinil?__tn__=%3C
091 126 21 18,"P2011 Tháp G5, Five Star Garden, Ngõ 460 Khương Đình, Thanh Xuân, Hà Nội., Hà Đông, Vietnam",N/A,Mỹ Phẩm & Thời Trang Thùy Dương Xứ Nghệ,https://www.facebook.com/thuyduongxunghespa?__tn__=%3C
096 881 79 36,"Lô V10 - A11 The Terra An Hưng, số 102 Nguyễn Thanh Bình, P. Dương Nội, TP Hà Nội, Hà Đông, Vietnam",N/A,Phòng khám Da liễu & Thẩm mỹ Quốc tế GSV - GSV Clinic & Beauty,https://www.facebook.com/GSVClinicBeauty?__cft__[0]=AZaTwap5qnkBAz6kK-niY_IfDP6noKIbkfMvTMTTtMAyJHrD_r53Ti-CxBVelq3krnrtvQstRRQXNwFaB7rUXeWl56aPlV98Xh5kOuafSXcT6WcP9chjPyBl79fCMEctHma2y_1lh8giVRZq_7goi6Dm5mRsyrqO3HsTEjqxveDVRbDMsAaMEoH1LwqWryrGIKwjp7BF7xnQWYgvLFo8Qs57B0TPV3hFQlZeQmpxTmgiVus06n-bYrqxCq0-DoJYig3QmNuaJJ8IaSiquafa-9Xv&__tn__=%3C%2CP-R
N/A,"96 Cầu Giấy, Hanoi, Vietnam",N/A,TopBeauty- Mỹ Phẩm Trang Điểm,https://www.facebook.com/MyPhamTrangDiemVaSacDep?__tn__=%3C
039 848 4095,N/A,N/A,Mỹ Phẩm Chính Hãng-Ngọc Ánh,https://www.facebook.com/profile.php?id=100063675985095&__tn__=%3C
N/A,"Ngõ Ga Hà Đông, Hà Nội, Việt Nam, Hà Đông, Vietnam",N/A,Thảo Auth - Chuyên dược mỹ phẩm,https://www.facebook.com/profile.php?id=100081904666503&__tn__=%3C
51726583947,"Cầu Đuống Nôi, Hà Nội, Việt Nam, Hà Đông, Vietnam",N/A,Ana Shop Mỹ Phẩm Chính Hãng,https://www.facebook.com/profile.php?id=100066422752739&__tn__=%3C
091 522 52 11,"Hà Nội, Tay Ho, Vietnam",N/A,MỸ PHẨM OLA,https://www.facebook.com/profile.php?id=61557291567450&__tn__=%3C
039 875 5663,"Cầu Mới Phường Yên Nghĩa, Hà Nội, Việt Nam, Hà Đông, Vietnam",N/A,OLIC - Mỹ Phẩm Chính Hãng,https://www.facebook.com/profile.php?id=100082211416662&__tn__=%3C
097 737 21 17,"Nhật Tân- Tây Hồ- Hà Nội, Tay Ho, Vietnam",N/A,Mỹ phẩm cao cấp Rich & Beauty Việt Nam,https://www.facebook.com/profile.php?id=100076010740407&__tn__=%3C
096 908 52 58,N/A,N/A,Chuyên dược mỹ phẩm nội địa Pháp,https://www.facebook.com/duocmyphamnoidiaphaptrangnhung?__tn__=%3C
036 404 3568,"Phố Văn Quán, Hà Nội, Việt Nam, Hà Đông, Vietnam",N/A,Chợ Mỹ Phẩm Chuyên Nghiệp,https://www.facebook.com/chomyphamhanoi?__tn__=%3C
033 992 4908,"Lê Văn Hiến, P.Đức Thắng, Q. Bắc Từ Liêm, Hanoi, Vietnam",N/A,Mỹ Phẩm Tóc Ngọc Linh,https://www.facebook.com/MyPhamTocNgocLinh68?__tn__=%3C
945292498,"25T2 Nguyễn Thị Thập , Hanoi, Vietnam",N/A,Belif Việt Nam Mỹ phẩm chính hãng Hàn Quốc,https://www.facebook.com/belif.vietnam.hanoi.hochiminh?__tn__=%3C
091 909 84 95,"Đường Lê Trọng Tấn, Hà Nội, Việt Nam, Hà Đông, Vietnam",N/A,Mỹ Phẩm làm đẹp- Thực phẩm CN CSSK,https://www.facebook.com/profile.php?id=100076388851059&__tn__=%3C
N/A,"Quan hoa cầu giấy hà nội, Vong Xuyen Noi, Vietnam",N/A,Shop Mỹ Phẩm Uy Tín,https://www.facebook.com/profile.php?id=61566118453017&__tn__=%3C
098 581 02 29,"Hà Nội, Hà Đông, Vietnam",N/A,Mỹ phẩm Hàn Quốc chính hãng 100%,https://www.facebook.com/myphamnhatchinhhang?__tn__=%3C
035 368 7439,"Hà Nội, Hanoi, Vietnam",N/A,OG Mỹ Phẩm Chính Hãng,https://www.facebook.com/OGcosmetics99?__tn__=%3C
098 598 23 91,"145 yên hoà cầu giấy hà nội, Hanoi, Vietnam",N/A,LUY Store - Nguồn Sỉ Mỹ Phẩm Chính Hãng,https://www.facebook.com/QuachHuongLy.Luy?__tn__=%3C
096 438 88 82,"162 cầu diễn hà nội, Hanoi, Vietnam",N/A,Mỹ Phẩm Mộc Linh Hương,https://www.facebook.com/myphammocthiennhien1?__tn__=%3C
033 358 1818,"BT06 ngõ 6 Nguyễn Văn Lộc, Mộ Lao, Hà Đông, Hanoi, Vietnam, Hà Đông, Vietnam",N/A,Huế Phạm - Dược Mỹ Phẩm Anh Quốc,https://www.facebook.com/profile.php?id=100084459987685&__tn__=%3C
093 430 04 88,N/A,N/A,Gia Dụng - Mỹ Phẩm Xách Tay,https://www.facebook.com/dathangquangchau80?__tn__=%3C
090 226 87 92,"Kiến Hưng, Hà Đông, Hà Nội., Ha Loi, Vietnam",N/A,Mỹ phẩm Beautyone- Thương hiệu mỹ phẩm thiên nhiên số 1 việt nam,https://www.facebook.com/profile.php?id=100068322344309&__tn__=%3C
989830015,"Số 6 ngõ 285 - Khuất Duy Tiến - Trung Hòa - Cầu Giấy , Hanoi, Vietnam",N/A,Mỹ Phẩm Tóc Thái Toàn,https://www.facebook.com/profile.php?id=100054532266121&__tn__=%3C
094 457 96 68,N/A,N/A,Huyền My - Chuyên Mỹ Phẩm Chính Hãng,https://www.facebook.com/HuyenMyChuyenMyPhamAuthentic?__tn__=%3C
N/A,N/A,N/A,Mỹ Phẩm Chính Hãng xách Tay,https://www.facebook.com/profile.php?id=100054402134687&__tn__=%3C
N/A,"Số 30 c3 khu đô thị geleximco dương nội hà đông , Hà Đông, Vietnam",N/A,Mỹ Phẩm Nhập Khẩu Hàn Quốc Cao cấp Haulink Cosmetics,https://www.facebook.com/profile.php?id=100088890338048&__tn__=%3C
975399911,"từ liêm, Hanoi, Vietnam",N/A,Review Mỹ Phẩm,https://www.facebook.com/MeoMakupLamDep?__tn__=%3C
092 933 86 56,"Số 17lk6b mỗ lao -hà đông- Hà Nội , Hà Đông, Vietnam",N/A,Mỹ phẩm Spa Hàn Nhật,https://www.facebook.com/myphamspanoidia?__tn__=%3C
035 625 5186,N/A,N/A,Mỹ phẩm Mioskin Việt Nam,https://www.facebook.com/MyphamMioskin?__tn__=%3C
037 267 0364,"chương mỹ hà nội, Hà Đông, Vietnam",N/A,Mỹ Phẩm Order Chính Hãng,https://www.facebook.com/profile.php?id=100056418228665&__tn__=%3C
096 853 65 66,"Tam Hưng Hà Nội, Hanoi, Vietnam",N/A,Mỹ phẩm Hà Nội mẹ Bi Bông,https://www.facebook.com/profile.php?id=100083011823071&__tn__=%3C
1800 646890,N/A,N/A,Cỏ mềm HomeLab,https://www.facebook.com/comemhomelab?__tn__=%3C
036 869 2110,N/A,N/A,Linh Nấm - Mỹ phẩm chính hãng,https://www.facebook.com/linhnammp?__tn__=%3C
N/A,"BTT4-8 Him Lam, phường Vạn Phúc, Hà Đông, Hà Nội, Hanoi, Vietnam, Hanoi, Vietnam",N/A,Suto Care - Mỹ Phẩm Xanh,https://www.facebook.com/profile.php?id=61582398928088&__tn__=%3C
N/A,"Chung cư The Terra An Hưng, Hà Đông, Vietnam",N/A,LACO - Mỹ phẩm hữu cơ,https://www.facebook.com/profile.php?id=61550062888126&__tn__=%3C
033 384 9092,N/A,N/A,Mỹ phẩm HABN cao cấp,https://www.facebook.com/profile.php?id=100076261472180&__tn__=%3C
079 271 2822,"Phòng 201 , Tầng 2 , Số nhà 33D5, Khu giãn dân Yên Phúc, Phường Phúc La, Quận Hà Đông , Hà Đông, Vietnam",N/A,Shop mỹ phẩm Hi Beauty Chính Hãng,https://www.facebook.com/profile.php?id=100063867681916&__tn__=%3C
096 598 38 95,"BTT4-8 Him Lam, phường Vạn Phúc, Hà Đông, Hà Nội, Hanoi, Vietnam, Hanoi, Vietnam, Hanoi, Vietnam",N/A,ShoYa Mỹ Phẩm Chính Hãng,https://www.facebook.com/profile.php?id=61567519335861&__tn__=%3C
888325205,"Thanh Xuân, Hanoi, Vietnam",N/A,Tổng Kho Sỉ Mỹ Phẩm,https://www.facebook.com/Tongkhisimypham?__tn__=%3C
098 698 99 44,"Văn quán, hà đông, Hà Đông, Vietnam",N/A,Vinbeauty - Mỹ phẩm nhập khẩu,https://www.facebook.com/vinbe.vn?__tn__=%3C
038 226 8064,"Đường La Nội, Hà Nội, Việt Nam, Hà Đông, Vietnam",N/A,Dani-Mỹ Phẩm Nội Địa Chính Hãng,https://www.facebook.com/myphamnoidiatrungchinhhangnhat?__tn__=%3C
878199450,"47 Nguyễn Hoàng - Phường Mỹ Đình 2 - Quận Nam Từ Liêm - Hà Nội, Hanoi, Vietnam, Hanoi, Vietnam",N/A,Dược Mỹ Phẩm - HHChính Hãng,https://www.facebook.com/duocmyphamthienduocchinhhang?__tn__=%3C
N/A,"Trung Hoà- Cầu Giấy, Hanoi, Vietnam",N/A,Roses- Mỹ phẩm chính hãng,https://www.facebook.com/profile.php?id=100084264505488&__tn__=%3C
097 335 42 73,"257 Vũ Tông Phan, phường Khương Trung, Quận Thanh Xuân, Hanoi, Vietnam",N/A,Zippy Store Mỹ Phẩm Hàn Quốc,https://www.facebook.com/ZippyStoreMyPhamChinhHang?__tn__=%3C
N/A,N/A,N/A,Mỹ phẩm nội địa Hàn Quốc chính hãng,https://www.facebook.com/profile.php?id=100063557983063&__tn__=%3C
096 304 84 67,N/A,N/A,Mỹ Phẩm Chuyên Sỉ Giá Tốt (Hàn Quốc A),https://www.facebook.com/mpcsgt3?__tn__=%3C
094 208 00 80,N/A,N/A,Janssen Cosmetics Viet Nam,https://www.facebook.com/janssencosmeticvietnam?__cft__[0]=AZY7-l6HXXQtA8Jfq7KTZ-8CFzwiDZ0iKxw1hlhDDMDO2H56kGQbI5Vfl_JUqVt6i1on9uhTl8ILIa9MZXoxjgFyGKmLUzYWDwYvV0wj2siWgaP_Lti91elBFLnp56QA8bUDWS1iErqgh9HaY15Golm6-5av7hbEoIZlPIYCRZqyqHM7BpcexB7R3_xq2XvThJbDCc47fUWLVUJO84LlgwUHBRsjaS1XjRU_p3MjG2JjMVoq1qSf4u0dZesTgUeOmZnOY8e3-Hjrbj-B6zgbltBt4fGz0kZKy2e35LUGqvXeILDR1i81j5tiCDZyopOpiTw&__tn__=%3C%2CP-R
093 630 45 03,"Đồng trữ -Phú Nghĩa -Hà Nội, Hanoi, Vietnam",N/A,Dược mỹ phẩm chính hãng sỉ -lẻ,https://www.facebook.com/profile.php?id=61584852846434&__tn__=%3C
036 462 6664,"Nguyễn Cơ Thạch, Hanoi, Vietnam",N/A,Bielenda - Mỹ phẩm thiên nhiên,https://www.facebook.com/bielenda.vn?__tn__=%3C
076 668 2234,N/A,N/A,Thế Giới Mỹ Phẩm Xách Tay,https://www.facebook.com/HUNGTHUY994?__tn__=%3C
091 391 85 58,"Phố Hà Cầu, Hà Nội, Việt Nam, Hà Đông, Vietnam",N/A,"Nghi cosmetic chuyên mỹ phẩm xách tay, thực phẩm chức năng",https://www.facebook.com/profile.php?id=100076900419103&__tn__=%3C
N/A,"BT-04 Ngõ 6 Nguyễn Văn Lộc, Hà Đông, Hà Nội, Hà Đông, Vietnam",N/A,CEO Phạm Huế - Dr.Uk Dược mỹ phẩm trị nám Anh Quốc,https://www.facebook.com/profile.php?id=100083723582729&__tn__=%3C
091 198 43 88,"Số 97 Thảo Nguyên - khu đô thị Ecopark, Văn Giang, Hung Yen, Vietnam",N/A,Puderma - Mỹ Phẩm Chính Hãng,https://www.facebook.com/Puderma.MyPham.ChinhHang?__tn__=%3C
090 848 24 88,"15 Hàng Mắm, Lý Thái Tổ, Hoàn Kiếm, Hà Nội, Hanoi, Vietnam",N/A,La Beauté,https://www.facebook.com/15HangMam?__tn__=%3C
N/A,N/A,N/A,Hoa Pham Hàng Mỹ,https://www.facebook.com/HoaPhamHangMy6868?__tn__=%3C
938835881,N/A,N/A,AnThy Pham,https://www.facebook.com/anthyphamchinhchu?__tn__=%3C
N/A,"110 B13 Kim Liên ( đường Lương Đình Của ), Hanoi, Vietnam",N/A,Hàng Nhật xách tay - IKID,https://www.facebook.com/hangnhat.donhatban.xachtay?__tn__=%3C
966655248,"Tân Tây Đô, Hoai Duc Phu, Vietnam",N/A,Huyền Phạm,https://www.facebook.com/HuyenPhamHeracos?__tn__=%3C
N/A,"Số 6 Nguyễn Trung Trực Phường 5 Quận Bình Thạnh Thành Phố Hồ Chí Minh, Ho Chi Minh City, Vietnam",N/A,Hội Review Mỹ Phẩm Và Kinh Nghiệm Làm Đẹp Hàn Quốc,https://www.facebook.com/profile.php?id=100067874869218&__tn__=%3C
094 669 26 16,"Block 8-TM3-16 Khu Đô Thị The Manor Central Prak Nguyễn Xiển , Đại Kim, Hoàng Mai, Hà Nội, Phùng Khoang, Vietnam",N/A,Dược Mỹ Phẩm Dr.HEDISON Hàn Quốc - ĐỖ TỊNH TRỰC THUỘC CÔNG TY,https://www.facebook.com/profile.php?id=100043018731274&__tn__=%3C
098 892 69 81,"Chợ Đại Hưng , Hung Yen, Vietnam",N/A,Ngọc Ánh Cosmetic,https://www.facebook.com/MyPhamChinhHangHungYen?__tn__=%3C
0868 000 166,"Đường Số 15 Thành Phố Giao Lưu, Hanoi, Vietnam",N/A,Ngoc Beauty - Chuyên Hàng Xách Tay Chính Hãng,https://www.facebook.com/myphamxachtayngocbeauty?__tn__=%3C
098 673 72 02,"10 Dương Quảng Hàm, Hanoi, Vietnam",N/A,LaLuong Beauty,https://www.facebook.com/MyPhamLaluong?__tn__=%3C
097 333 33 62,"Mặt sau Smile Building, số 01, phố Nguyễn Cảnh Dị, Hanoi, Vietnam",N/A,Zô Shop,https://www.facebook.com/ShopOfZo?__tn__=%3C
N/A,N/A,N/A,Gia Dụng Nhà XInh,https://www.facebook.com/EvaMyPhamTrangDiem?__tn__=%3C
N/A,"79 Ngụy Như Kon Tum, phường Thanh Xuân, Hà Nội, Hanoi, Vietnam",N/A,Tiếng Hàn Thầy Tư,https://www.facebook.com/tienghanthaytuofficial?__tn__=%3C
097 966 77 25,"Số 2 ngõ 292 Nghi Tàm, Yên Phụ, Tây Hồ, Hanoi, Vietnam",N/A,Bimore,https://www.facebook.com/bimore.vn?__tn__=%3C
036 339 9796,"172 Cầu Giấy, Hà Nội, Hanoi, Vietnam",N/A,Chamy Clothing,https://www.facebook.com/Chamyclothing?__tn__=%3C
098 172 30 60,N/A,N/A,Kem Bôi Cao Ngựa Nhập Khẩu,https://www.facebook.com/MyPhamNhapKhauCs2?__tn__=%3C
093 488 99 60,"24 Hai Bà Trưng, tp Huế, Hue, Vietnam",N/A,Yen Tran - Skincarelover,https://www.facebook.com/yenmyphamhq?__tn__=%3C
097 999 34 39,N/A,N/A,iPhone Giá Rẻ Nhất,https://www.facebook.com/iphonegiarenhatmang?__tn__=%3C
097 965 88 85,"D1 ngõ 7 Khuất Duy Tiến, Thanh Xuân Bắc, Thanh Xuân, Hanoi, Vietnam",N/A,Jesse Store,https://www.facebook.com/jesse.com.vn?__tn__=%3C
032 990 2111,"36 cầu bưu, Hà Đông, Vietnam",N/A,Sao Thái Dương Chăm Sức Khỏe,https://www.facebook.com/MyPhamThaiDuong2020?__tn__=%3C
097 589 21 79,N/A,N/A,"Mỹ phẩm, quần áo Order Hàn Quốc",https://www.facebook.com/Ankhanhoder?__tn__=%3C
096 262 62 52,N/A,N/A,Mỹ Phẩm Thiên Nhiên,https://www.facebook.com/MyPhamThienNhienQlinne?__tn__=%3C
974746742,N/A,N/A,Mỹ Phẩm TNT,https://www.facebook.com/myphamTNT86?__tn__=%3C
036 253 6102,"68 Khúc Thừa Dụ - Cầu Giấy - Hà Nội, Hanoi, Vietnam",N/A,Mỹ Phẩm Chính Hãng,https://www.facebook.com/profile.php?id=61559079581040&__tn__=%3C
090 144 49 99,"333 Tiểu La , Da Nang, Vietnam",N/A,Mỹ Phẩm Quốc Tế Huong Ceo,https://www.facebook.com/hclastingcompany?__tn__=%3C
N/A,"Sơn Tây Hà Nội, Hanoi, Vietnam",N/A,Mỹ phẩm diamond_luxury,https://www.facebook.com/profile.php?id=61551675915255&__tn__=%3C
