License Key,Company Name,City,Country
0195893594146,PHAM THI TUYET NHUNG,HCM,Viet Nam
506108364,LUCY PHAM,Ho Chi Minh City,Viet Nam
893616089,PHẠM VĂN KHOA 1981,"tỉnh Hà Nam, Việt Nam",Viet Nam
893619153,PHẠM ĐỢI,Việt Nam,Viet Nam
893619191,PHẠM THỊ THU HUỆ,Việt Nam,Viet Nam
893619484,CƠ SỞ MỸ PHẨM PHẠM QUÂN,Việt Nam,Viet Nam
8938524089,CÔNG TY TNHH MỸ PHẨM PHẠM THÚY,Việt Nam,Viet Nam
8938526656,MỸ PHẨM MY BEAUTY,"VIỆT NAM, Việt Nam",Viet Nam
8938528819,PHẠM THỊ THU THỦY,Việt Nam,Viet Nam
8938529186,MỸ PHẨM HUNA,Việt Nam,Viet Nam
8938529982,PHẠM VĂN TOẢN,Việt Nam,Viet Nam
8938533614,PHẠM ĐIỆP,"Kiên Giang, Việt Nam",Viet Nam
8938535118,PHẠM THỊ THU HÀ,"Yên Bái, Việt Nam",Viet Nam
8938535355,CÔNG TY DƯỢC PHẨM D.K.N.H,Việt Nam,Viet Nam
8938535658,PHẠM THỊ THỰC,Việt Nam,Viet Nam
8938536827,HIỀN PHẠM,Việt Nam,Viet Nam
8938539553,PHẠM BÁ ĐỒNG,"Thanh Hóa, Việt Nam",Viet Nam
8938539577,PHẠM THỊ YẾN,"Bắc Ninh, Việt Nam",Viet Nam
8938541239,CÔNG TY TNHH DƯỢC PHẨM PHẠM GIA,Việt Nam,Viet Nam
8938557301,CÔNG TY TNHH DƯỢC PHẨM MỸ PHẨM G.I.A,Việt Nam,Viet Nam
